{"artifact":{"artifactType":"application/vnd.crabbox.aws-image-evidence.v1","digest":"sha256:1111111111111111111111111111111111111111111111111111111111111111","mediaType":"application/vnd.oci.image.manifest.v1+json","reference":"ghcr.io/example-org/crabbox-aws-image-candidates@sha256:1111111111111111111111111111111111111111111111111111111111111111","repository":"ghcr.io/example-org/crabbox-aws-image-candidates","signatureDigest":"sha256:2222222222222222222222222222222222222222222222222222222222222222","signatureType":"application/vnd.dev.sigstore.bundle.v0.3+json"},"evidence":[{"digest":"sha256:5555555555555555555555555555555555555555555555555555555555555555","mediaType":"application/vnd.crabbox.aws-image-evidence-manifest.v1+json","name":"bundle.json","size":501},{"digest":"sha256:6666666666666666666666666666666666666666666666666666666666666666","mediaType":"application/vnd.crabbox.aws-image-candidate.v1+json","name":"candidate.json","size":602},{"digest":"sha256:7777777777777777777777777777777777777777777777777777777777777777","mediaType":"application/vnd.in-toto+json","name":"provenance.intoto.jsonl","size":703},{"digest":"sha256:8888888888888888888888888888888888888888888888888888888888888888","mediaType":"application/json","name":"recipe.json","size":804},{"digest":"sha256:9999999999999999999999999999999999999999999999999999999999999999","mediaType":"application/spdx+json","name":"sbom.spdx.json","size":905},{"digest":"sha256:aaaaaaaaaaaaaaaaaaaaaaaaaaaaaaaaaaaaaaaaaaaaaaaaaaaaaaaaaaaaaaaa","mediaType":"application/json","name":"scrub-report.json","size":106}],"imageRecipe":{"digest":"sha256:4444444444444444444444444444444444444444444444444444444444444444","path":"recipes/aws/v1/linux-devtools.json"},"readiness":{"profile":"linux-builder","recipe":"recipes/linux/v1/linux-builder.json","recipeDigest":"sha256:3333333333333333333333333333333333333333333333333333333333333333"},"schema":"crabbox-aws-image-qualification-input/v1","signature":{"issuer":"github-actions","mode":"keyless","workflowIdentity":"example-org/crabbox/.github/workflows/devtools-image-publish.yml@refs/heads/main"},"source":{"commit":"aaaaaaaaaaaaaaaaaaaaaaaaaaaaaaaaaaaaaaaa","repository":"example-org/crabbox","workflow":{"ref":"example-org/crabbox/.github/workflows/devtools-image-publish.yml@refs/heads/main","runAttempt":"1","runId":"123"}},"target":{"amiId":"ami-123abc","architecture":"x86_64","baseImage":"ami-base123","instanceType":"m7i.large","platform":"linux","region":"us-west-2","snapshotIds":["snap-123abc"]}}
